Title	Budget	Box_Office	Star1	Star2	Star3	Star_num1	Star_num2	Star_num3	Name	Year	Run_Time	Genre	Director_num	Writer_num	Average_Rating	Num_Voters	Story_Line	Ratio
tt0441773	130000000	631746197	Jack Black	Ian McShane	Angelina Jolie	nm0085312	nm0574534	nm0001401	Kung Fu Panda	2008	92	"Action,Adventure,Animation"	"nm0651706,nm0828970"	"nm0008743,nm0074184,nm0717550,nm0903456"	7.5	389113	"It's the story about a lazy, irreverent slacker panda, named Po, who is the biggest fan of Kung Fu around...which doesn't exactly come in handy while working every day in his family's noodle shop. Unexpectedly chosen to fulfill an ancient prophecy, Po's dreams become reality when he joins the world of Kung Fu and studies alongside his idols, the legendary Furious Five -- Tigress, Crane, Mantis, Viper and Monkey -- under the leadership of their guru, Master Shifu. But before they know it, the vengeful and treacherous snow leopard Tai Lung is headed their way, and it's up to Po to defend everyone from the oncoming threat. Can he turn his dreams of becoming a Kung Fu master into reality? Po puts his heart - and his girth - into the task, and the unlikely hero ultimately finds that his greatest weaknesses turn out to be his greatest strengths."	3.859586093
tt0396752	25000000	121500821	Emma Thompson	Colin Firth	Angela Lansbury	nm0000668	nm0000147	nm0001450	Nanny McPhee	2005	97	"Comedy,Family,Fantasy"	nm0428600	"nm0000668,nm0104447"	6.5	62774	Mr. Cedric Brown has just lost his wife and is now left with his seven children who misbehave so much that all the nannies have run away. Now he is told by a mysterious voice that he should get Nanny McPhee who is a magical woman with special powers.	3.860032646
tt2913948	4000	19463	Gregg Adams	John Anderson	Bryan Bermingham	nm3179879	nm5695424	nm5675114	Whensday	2013	100	Comedy	"nm5675036,nm5673979,nm2294635,nm0380526"	\N	7.5	22	"Documentarian Abe Benjamin stumbles across an old cassette tape in a thrift store that leads him to investigate the mysterious origin of a bamboo bike and the odd little girl who accompanies it on its journey through time. Unbeknownst to Abe, the Braughman Brothers Security Team are on the hunt for the same bike at the request of their billionaire boss and best friend Joe Panda. Chaos ensues."	3.864533867
tt1109624	55000000	268047808	Hugh Bonneville	Sally Hawkins	Julie Walters	nm0095017	nm1020089	nm0910278	Paddington	2014	95	"Adventure,Comedy,Family"	nm1653753	"nm1653753,nm0566100,nm1286491"	7.2	87106	"A young Peruvian bear with a passion for all things British travels to London in search of a home. Finding himself lost and alone at Paddington Station, he begins to realize that city life is not all he had imagined - until he meets the kind Brown family, who read the label around his neck ('Please look after this bear. Thank you.') and offer him a temporary haven. It looks as though his luck has changed until this rarest of bears catches the eye of a museum taxidermist."	3.87359642
tt7040874	20000000	97644617	Anna Kendrick	Blake Lively	Henry Golding	nm0447695	nm0515116	nm6525901	A Simple Favor	2018	117	"Comedy,Crime,Drama"	nm0082450	"nm9079127,nm0789366"	6.8	97839	"Stephanie is a single mother with a parenting vlog who befriends Emily, a secretive upper-class woman who has a child at the same elementary school. When Emily goes missing, Stephanie takes it upon herself to investigate."	3.882230606
tt4643580	5300000	25892561	Bruno Bichir	Carlos Espejel	Angélica Vale	nm0080966	nm0260846	nm0883875	Huevos: Little Rooster's Egg-cellent Adventure	2015	98	"Adventure,Animation,Comedy"	"nm2319883,nm5228798,nm1349604"	"nm1055128,nm2296859,nm2319883,nm1349604,nm5228798,nm2949944,nm4080720"	5.8	858	"The world's most egg-cellent animated (Huevo Cartoon) series finally cracks the U.S. big screen with UN GALLO CON MUCHOS HUEVOS! Toto, (voiced by Bruno Bichir) was born the runt of the litter. But, when an evil rancher threatens to destroy his home and his family, Toto must go from a timid young ""chicken"" to a brave and scrappy rooster. Toto and his friends (voices include: Angelica Vale, Maite Perroni, Omar Chaparro, Ninel Conde, Carlos Espejel) must band together on an egg-citing adventure that will prove that big surprises can come from little packages."	3.885387946
tt1305907	972824	4759454	Jack Neo	Mark Lee	Henry Thia	nm0626090	nm0497834	nm0857726	Money No Enough II	2008	126	"Comedy,Drama"	nm0626090	nm0626090	6	146	"3 brothers living in Singapore, each leading a different lifestyle. They discover the deeper meanings in life as tragedies unfold, with comedy & tears along the way."	3.892405109
tt0144084	7000000	34266564	Christian Bale	Justin Theroux	Josh Lucas	nm0000288	nm0857620	nm0524197	American Psycho	2000	101	"Crime,Drama"	nm0366004	"nm0254735,nm0366004,nm0877587"	7.6	441472	"Patrick Bateman is handsome, well educated and intelligent. He is twenty-seven and living his own American dream. He works by day on Wall Street, earning a fortune to complement the one he was born with. At night he descends into madness, as he experiments with fear and violence."	3.895222729
tt4824308	5000000	24487848	Melissa Joan Hart	Jesse Metcalfe	David A.R. White	nm0004997	nm0582462	nm0924684	God's Not Dead 2	2016	120	Drama	nm1880561	"nm0465484,nm0813301"	4.3	10566	"When a high school teacher is asked a question in class about Jesus, her response lands her in deep trouble."	3.89756862
tt1306980	8000000	39187783	Joseph Gordon-Levitt	Seth Rogen	Anna Kendrick	nm0330687	nm0736622	nm0447695	50/50	2011	100	"Comedy,Drama,Romance"	nm1349522	nm1672425	7.6	303750	"Adam is a 27 year old writer of radio programs and is diagnosed with a rare form of spinal cancer. With the help of his best friend, his mother, and a young therapist at the cancer center, Adam learns what and who the most important things in his life are."	3.898472263
tt2096673	175000000	857611174	Amy Poehler	Bill Hader	Lewis Black	nm0688132	nm0352778	nm0085400	Inside Out	2015	95	"Adventure,Animation,Comedy"	"nm0230032,nm0215455"	"nm0230032,nm0215455,nm0498834,nm2155757,nm1578335,nm2919995,nm0352778,nm0688132"	8.2	551625	"Growing up can be a bumpy road, and it's no exception for Riley, who is uprooted from her Midwest life when her father starts a new job in San Francisco. Like all of us, Riley is guided by her emotions - Joy, Fear, Anger, Disgust and Sadness. The emotions live in Headquarters, the control center inside Riley's mind, where they help advise her through everyday life. As Riley and her emotions struggle to adjust to a new life in San Francisco, turmoil ensues in Headquarters. Although Joy, Riley's main and most important emotion, tries to keep things positive, the emotions conflict on how best to navigate a new city, house and school."	3.900635252
tt5580036	11000000	53939297	Margot Robbie	Sebastian Stan	Allison Janney	nm3053338	nm1659221	nm0005049	"I, Tonya"	2017	120	"Biography,Comedy,Drama"	nm0318916	nm0737216	7.5	149486	"From the proverbial wrong side of the tracks in Portland, Oregon, former competitive figure skater Tonya Harding was never fully accepted in the figure skating community for not inherently being the image of grace, breeding and privilege that the community wanted to portray, despite she being naturally gifted in the sport athletically. Despite ultimately garnering some success in figure skating being national champion, a world championship medalist, an Olympian, and being the first American woman to complete a Triple Axel in competition, she is arguably best known for her association to ""the incident"": the leg bashing on January 6, 1994 of her competitor, Nancy Kerrigan, who, unlike Tonya, was everything that the figure skating community wanted in their representatives. Her association to that incident led to Tonya being banned from competitive figure skating for life. Tonya's story from the beginning of her figure skating life at age four to the aftermath of the incident is presented..."	3.903572009
tt0195714	23000000	112880294	Devon Sawa	Ali Larter	Kerr Smith	nm0001701	nm0005123	nm0005445	Final Destination	2000	98	"Horror,Thriller"	nm0939128	"nm0604688,nm0939128,nm0714695"	6.7	214841	"Alex is boarding a plane to France on a school trip, when he suddenly gets a premonition that the plane will explode. Shortly after Alex, a group of students, and his teacher are thrown off the plane, to their horror, the plane does in fact explode. Alex must now work out Death's plan, as each of the survivors falls victim. Whilst trying to prevent the next death, Alex must also dodge the FBI, who believe that he caused the explosion."	3.907838656
tt1895587	20000000	98275238	Mark Ruffalo	Michael Keaton	Rachel McAdams	nm0749263	nm0000474	nm1046097	Spotlight	2015	129	"Biography,Crime,Drama"	nm0565336	"nm1802857,nm0565336"	8.1	375393	"When the Boston Globe's tenacious ""Spotlight"" team of reporters delves into allegations of abuse in the Catholic Church, their year-long investigation uncovers a decades-long cover-up at the highest levels of Boston's religious, legal, and government establishment, touching off a wave of revelations around the world."	3.913761654
tt2203939	40000000	196710396	Cameron Diaz	Leslie Mann	Kate Upton	nm0000139	nm0005182	nm4478322	The Other Woman	2014	109	"Comedy,Romance"	nm0001024	nm2602433	6	124503	"After discovering her boyfriend is married, Carly Whitten tries to get her ruined life back on track. But when she accidentally meets the wife he's been cheating on, she realizes they have much in common, and her sworn enemy becomes her greatest friend. When yet another affair is discovered, all three women team up to plot mutual revenge on their cheating, lying, three-timing SOB."	3.917759777
tt0800341	10000000	49282156	Sang-kyung Kim	Yo-won Lee	Sung-Ki Ahn	nm1235292	nm1030827	nm0014227	May-18	2007	120	Drama	nm1537157	"nm1593802,nm0661931"	7	925	"Kang Min Woo leads a relatively peaceful life with his younger brother Kang Jin Woo. Min Woo has been captivated by Park Shin Ae, friend to Jin Woo and daughter to Park Heung Su. Min Woo, being shy, manipulates Shin Ae into going to the movies with him and his brother, Jin Woo, by telling her it's out of sympathy for his brother who studies too hard. The next day at the theaters, while Min Woo was in amusement from watching a film smoke began seeping in. An outburst came through the doors of a soldier beating a man to death and everyone inside ran out of the theatre in fear. That day soldiers went on a rampage against the citizens, assaulting everyone and anyone. Park Heung Su, father to Shin Ae, tried to find out what was happening by seeking out General Choi who was in-charge of this infiltration into his town. But nothing could stop the soldiers not even Heung Su who was once a general himself. The citizens form a militia were determined to protect their loved ones. Out of anger ..."	3.928215107
tt0195685	52000000	256271286	Julia Roberts	Albert Finney	David Brisbin	nm0000210	nm0001215	nm0109773	Erin Brockovich	2000	131	"Biography,Drama"	nm0001752	nm0335666	7.3	161540	"Erin Brockovich-Ellis is an unemployed single mother, desperate to find a job, but is having no luck. This losing streak even extends to a failed lawsuit against a doctor in a car accident she was in. With no alternative, she successfully browbeats her lawyer to give her a job in compensation for the loss. While no one takes her seriously, with her trashy clothes and earthy manners, that soon changes when she begins to investigate a suspicious real estate case involving the Pacific Gas & Electric Company. What she discovers is that the company is trying quietly to buy land that was contaminated by hexavalent chromium, a deadly toxic waste that the company is improperly and illegally dumping and, in turn, poisoning the residents in the area. As she digs deeper, Erin finds herself leading point in a series of events that would involve her law firm in one of the biggest class action lawsuits in American history against a multi-billion dollar corporation."	3.928293867
tt1905041	160000000	788679850	Vin Diesel	Paul Walker	Dwayne Johnson	nm0004874	nm0908094	nm0425005	Fast & Furious 6	2013	130	"Action,Adventure,Thriller"	nm0510912	"nm0604555,nm0860155"	7.1	351543	"Since Dom (Diesel) and Brian's (Walker) Rio heist toppled a kingpin's empire and left their crew with $100 million, our heroes have scattered across the globe. But their inability to return home and living forever on the lam have left their lives incomplete. Meanwhile, Hobbs (Johnson) has been tracking an organization of lethally skilled mercenary drivers across 12 countries, whose mastermind (Evans) is aided by a ruthless second-in-command revealed to be the love Dom thought was dead, Letty (Rodriguez). The only way to stop the criminal outfit is to outmatch them at street level, so Hobbs asks Dom to assemble his elite team in London. Payment? Full pardons for all of them so they can return home and make their families whole again."	3.929249032
tt4630562	250000000	1236005118	Vin Diesel	Jason Statham	Dwayne Johnson	nm0004874	nm0005458	nm0425005	The Fate of the Furious	2017	136	"Action,Adventure,Thriller"	nm0336620	"nm0860155,nm0604555"	6.7	186768	"Now that Dom and Letty are on their honeymoon and Brian and Mia have retired from the game-and the rest of the crew has been exonerated-the globetrotting team has found a semblance of a normal life. But when a mysterious woman seduces Dom into the world of crime he can't seem to escape and a betrayal of those closest to him, they will face trials that will test them as never before. From the shores of Cuba and the streets of New York City to the icy plains off the arctic Barents Sea, the elite force will crisscross the globe to stop an anarchist from unleashing chaos on the world's stage... and to bring home the man who made them a family."	3.944020452
tt5266678	10000000	49567466	Zishan Yang	Bai-Ke	Bo-lin Chen	nm4339355	nm7403141	nm1250939	Surprise	2015	96	"Adventure,Comedy,Fantasy"	nm6157250	nm6157250	5.1	306	"Surprise follows the day-to-day misadventures of a character called Dachui Wang as he navigates though various modern and classic situations. The little monster Wang Dachui, who was born with sharp ears & simple magic, made him different from the ordinaries. The local monster king, he thought he was. But to his surprise, on the one hand, his fate has changed since the encounter with Tang Monk, Monkey King, Piggy & Sand Monk. On the other hand, the meeting with Wang Dachui also should have been the great 82nd disaster to the four."	3.956746104
tt3801934	5000000	24817852	Louis Koo	Shawn Yue	Liya Tong	nm0465503	nm1284845	nm4405625	Wild City	2015	120	"Action,Crime,Thriller"	nm0482681	"nm0482681,nm2597943,nm3018849"	5.7	748	A cop-turned-bar owner befriends a drunken woman at closing hours and finds himself pursued by her former lover and the thugs he employs. The chase turns deadly when the bar owner's deadbeat brother and a suitcase full of cash enter the picture.	3.963569407
tt2024432	35000000	173965010	Jason Bateman	Melissa McCarthy	John Cho	nm0000867	nm0565250	nm0158626	Identity Thief	2013	111	"Comedy,Crime,Drama"	nm1164861	"nm0563301,nm1087085"	5.7	117568	"Sandy Patterson (Jason Bateman) gets a nice call confirming his name and other identifying information. The next thing he knows, a spa in Florida is reminding him of his appointment and his credit cards are maxed out. With his identity stolen, Sandy leaves his wife, kids and job to literally bring the thief to justice in Colorado. Keeping tabs on the other Sandy (Melissa McCarthy) and run-ins with bounty hunters is harder than he was expecting, and ultimately the cross-country trip is going to find both Sandys learning life tips from one another."	3.970428715
tt1482459	70000000	348840316	Zac Efron	Taylor Swift	Danny DeVito	nm1374980	nm2357847	nm0000362	The Lorax	2012	86	"Adventure,Animation,Drama"	"nm0719208,nm0049633"	"nm0317450,nm0666791,nm0202425"	6.4	91543	"In the walled city of Thneed-Ville, where everything is artificial and even the air is a commodity, a boy named Ted hopes to win the heart of his dream girl, Audrey. When he learns of her wish to see a real tree, Ted seeks out the Once-ler, a ruined old businessman outside of town in a stark wasteland. Upon hearing of how the hermit gave into his greed for profits and devastated the land over the protests of the Lorax, Ted is inspired to undo the disaster. However, the greedy Mayor of Thneed-Ville, Aloysius O'Hare, has made his fortune exploiting the environmental collapse and is determined to stop the boy from undermining his business."	3.983433015
tt6793580	4553100	22698161	Javier Gutiérrez	Athenea Mata	Juan Margallo	nm0349522	nm0557992	nm0546584	Champions	2018	124	"Comedy,Drama,Sport"	nm0275250	"nm1319488,nm0275250"	7.2	6560	"Marco Montes is a basketball coach who works as second trainer of an important team of ACB (Spanish basketball national league), but in reality he is a man burned inside himself in his professional life as well as personal life, turning him in an arrogant and bad-mannered man. During an ACB's game, a discussion with the first trainer causes an incident and he's fired out from the stadium. Just later Marco, completely drunk, crashes unwittingly his car against a police car, being arrested. In the trial the judge makes Marco to decide: go to the jail for 2 years or passing 90 days making community services. Reluctant, Marco is forced to training a basketball team called ""Los Amigos"" (The Friends) formed by the mentally disabled players Manuel, Paquito, Jesús, Sergio, Fabián, Juanma, Benito, Marin and Collantes, and helped by old Julio, social center's director where they meet. At the same time that Marco tries to save his marriage with Sonia, a woman tired of his excuses about to have a..."	3.985209201
tt0305669	33000000	164729679	Steve Martin	Queen Latifah	Eugene Levy	nm0000188	nm0001451	nm0506405	Bringing Down the House	2003	105	Comedy	nm0788202	nm0276821	5.6	33535	"Peter Sanderson is a divorced, straight-laced, uptight attorney who still loves his ex-wife and can't figure out what he did wrong to make her leave him. However, Peter's trying to move on, and he's smitten with a brainy, bombshell barrister he's been chatting with online. However, when she comes to his house for their first face-to-face, she isn't refined, isn't Ivy League, and isn't even a lawyer. Instead, it's Charlene, a prison escapee who's proclaiming her innocence and wants Peter to help her clear her name. But Peter wants nothing to do with her, prompting the loud and shocking Charlene to turn Peter's perfectly ordered life upside down, jeopardizing his effort to get back with his wife and won a billion dollar client."	3.991808303
tt0120630	45000000	224834564	Mel Gibson	Julia Sawalha	Phil Daniels	nm0000154	nm0768018	nm0200057	Chicken Run	2000	84	"Adventure,Animation,Comedy"	"nm0661910,nm0520485"	"nm0520485,nm0661910,nm0456732,nm0123666,nm0640976"	7	166546	"Having been hopelessly repressed and facing eventual certain death at the chicken farm where they are held, Rocky the rooster and Ginger the chicken decide to rebel against the evil Mr. and Ms. Tweedy, the farm's owners. Rocky and Ginger lead their fellow chickens in a great escape from the murderous farmers and their farm of doom."	3.996323533
tt0364569	3000000	14999673	Min-sik Choi	Ji-tae Yu	Hye-jeong Kang	nm0158856	nm0949167	nm1367246	Oldboy	2003	120	"Action,Drama,Mystery"	nm0661791	"nm1628380,nm2057405,nm3820072,nm0661791,nm1367409,nm1369364"	8.4	469013	"Abducted on a rainy night in 1988, the obnoxious drunk, Oh Dae-Su, much to his surprise, wakes up locked in a windowless and dilapidated hotel room, for an unknown reason. There, his invisible and pitiless captors will feed him, clothe him, and sedate him to avert a desperate suicide--and as his only companion and a window to the world is the TV in his stark cell--the only thing that helps Oh Dae-Su keep going is his daily journal. Then, unexpectedly, after fifteen long years in captivity, the perplexed prisoner is deliberately released, encouraged to track down his tormentor to finally get his retribution. However, who would hate Oh Dae-Su so much he would deny him of a quick and clean death?"	3.999889333
tt1220634	60000000	300228084	Milla Jovovich	Ali Larter	Wentworth Miller	nm0000170	nm0005123	nm0589505	Resident Evil: Afterlife	2010	96	"Action,Adventure,Horror"	nm0027271	nm0027271	5.8	155023	"In a world ravaged by a virus infection, turning its victims into the Undead, Alice (Jovovich), continues on her journey to find survivors and lead them to safety. Her deadly battle with the Umbrella Corporation reaches new heights, but Alice gets some unexpected help from an old friend. A new lead that promises a safe haven from the Undead takes them to Los Angeles, but when they arrive the city is overrun by thousands of Undead - and Alice and her comrades are about to step into a deadly trap."	4.003801317
tt1596343	125000000	626137675	Vin Diesel	Paul Walker	Dwayne Johnson	nm0004874	nm0908094	nm0425005	Fast Five	2011	130	"Action,Adventure,Thriller"	nm0510912	"nm0604555,nm0860155"	7.3	334868	"Former cop Brian O'Conner partners with ex-con Dom Toretto on the opposite side of the law. Since Brian and Mia Toretto broke Dom out of custody, they've blown across many borders to elude authorities. Now backed into a corner in Rio de Janeiro, they must pull one last job in order to gain their freedom. As they assemble their elite team of top racers, the unlikely allies know their only shot of getting out for good means confronting the corrupt businessman who wants them dead. But he's not the only one on their tail. Hard-nosed federal agent Luke Hobbs never misses his target. When he is assigned to track down Dom and Brian, he and his strike team launch an all-out assault to capture them. But as his men tear through Brazil, Hobbs learns he can't separate the good guys from the bad. Now, he must rely on his instincts to corner his prey... before someone else runs them down first."	4.00910136
tt2034139	5000000	25051865	Ashley Bell	Julia Garner	Spencer Treat Clark	nm0068042	nm3400186	nm0004829	The Last Exorcism Part II	2013	88	"Horror,Thriller"	nm1424878	"nm3227090,nm1424878,nm1428204,nm0348640"	4	15267	"Seventeen year-old Nell Margaret Sweetzer is found completely insane when trying to explain her possession by the demon called Abalam. After medical and psychological treatment, she is sent to the Deveraux transition house in New Orleans managed by Frank Merle, who helps her to start a new life. She finds a job as a hotel housekeeper, befriends her new roommates, and develops a crush on her coworker, Chris. Soon, Nell comes to realize that she is haunted by people from her cult... and by the same evil force that once possessed her. When Nell meets Miss Cecile, she tells Nell that she has been following her since the hospital. Further, she discloses that she belongs to the sect Order of The Right Hand, and that they can protect her from the evil in an attempt to divert the prophecy of an apocalypse. Will Nell accept help, and be protected from the extremely powerful, evil force Abalam -- Or will she come to accept... herself?"	4.010371998
tt2103254	20000000	100375432	Melissa McCarthy	Susan Sarandon	Kathy Bates	nm0565250	nm0000215	nm0000870	Tammy	2014	97	"Comedy,Romance"	nm1229520	"nm0565250,nm1229520"	4.9	45079	"Tammy, who was recently fired from a Topper Jack's fast food restaurant, returns home only to find her husband enjoying a romantic meal with the neighbor. She quickly packs her necessities, and travels down three houses to her parent's home. Upon denied use of her mom's car to drive to Niagara Falls, she quickly resorts to an ""ailing"" grandmother, who also lives in the home...Only instead of traveling alone, Grandma Pearl wants in on the road trip. After realizing Grandma Pearl has the funds, they hit the road. Pearl soon proves to be quite the alcoholic despite her diabetes, and Tammy quickly turns into the ""baby-sitter."" From finding love in a bar to robbing a Topper Jack's in order to bail Pearl out of jail,the quirky adventure will have you finding yourself riding along for the misadventures of Tammy."	4.018771349
tt3862750	12000000	60273173	Sanaa Lathan	Michael Ealy	Morris Chestnut	nm0005125	nm1013003	nm0004820	The Perfect Guy	2015	100	"Crime,Drama,Horror"	nm1270033	"nm0568416,nm0931862"	5.6	9174	"After a painful breakup, successful lobbyist Leah Vaughn (Sanaa Lathan) jumps into a passionate relationship with a charming stranger (Michael Ealy). When her ex-boyfriend (Morris Chestnut) resurfaces in her life she has to figure out who she should trust and who she should fear."	4.022763998
tt0413267	160000000	804438141	Mike Myers	Cameron Diaz	Eddie Murphy	nm0000196	nm0000139	nm0000552	Shrek the Third	2007	93	"Adventure,Animation,Comedy"	"nm1844237,nm0401203"	"nm0696949,nm0780620,nm1844237,nm0912403,nm0011470,nm0825308,nm0254645,nm0744429,nm0776107,nm0830294"	6	260987	"When Fiona's father and King of Far Far Away passes away, the clumsy Shrek becomes the immediate successor of the throne. However, Shrek decides to find the legitimate heir Artie in a distant kingdom with his friends Donkey and Puss in Boots to be able return to his beloved house in the swamp with the pregnant Fiona. Meanwhile, the envious and ambitious Prince Charming joins the villains of the fairytales plotting a coup d'état to become the new king."	4.02773835
