Title	Budget	Box_Office	Star1	Star2	Star3	Star_num1	Star_num2	Star_num3	Name	Year	Run_Time	Genre	Director_num	Writer_num	Average_Rating	Num_Voters	Story_Line	Ratio
tt0264464	52000000	352114312	Leonardo DiCaprio	Tom Hanks	Christopher Walken	nm0000138	nm0000158	nm0000686	Catch Me If You Can	2002	141	"Biography,Crime,Drama"	nm0000229	"nm0622288,nm0007646,nm1127221"	8.1	739080	"New Rochelle, the 1960s. High schooler Frank Abagnale Jr. idolizes his father, who's in trouble with the IRS. When his parents separate, Frank runs away to Manhattan with $25 in his checking account, vowing to regain dad's losses and get his parents back together. Just a few years later, the FBI tracks him down in France; he's extradited, tried, and jailed for passing more than $4,000,000 in bad checks. Along the way, he's posed as a Pan Am pilot, a pediatrician, and an attorney. And, from nearly the beginning of this life of crime, he's been pursued by a dour FBI agent, Carl Hanratty. What starts as cat and mouse becomes something akin to father and son."	5.771428947
tt1263670	7000000	47405566	Jeff Bridges	Maggie Gyllenhaal	Colin Farrell	nm0000313	nm0350454	nm0268199	Crazy Heart	2009	112	"Drama,Music,Romance"	nm0178376	"nm0178376,nm3084575"	7.2	80379	"Bad Blake is a broken-down, hard-living country music singer who's had way too many marriages, far too many years on the road and one too many drinks way too many times. And yet, Bad can't help but reach for salvation with the help of Jean, a journalist who discovers the real man behind the musician."	5.772222747
tt1591479	12000000	81275130	Alex Veadov	Roselyn Sanchez	Nestor Serrano	nm0891514	nm0761052	nm0785594	Act of Valor	2012	110	"Action,Adventure,Drama"	"nm0566788,nm0915304"	nm0426500	6.5	64169	"An unprecedented blend of real-life heroism and original filmmaking, Act of Valor stars a group of active-duty Navy SEALs in a powerful story of contemporary global anti-terrorism. Inspired by true events, the film combines stunning combat sequences, up-to-the minute battlefield technology and heart-pumping emotion for the ultimate action adventure. Act of Valor takes audiences deep into the secretive world of the most elite, highly trained group of warriors in the modern world. When the rescue of a kidnapped CIA operative leads to the discovery of a deadly terrorist plot against the U.S., a team of SEALs is dispatched on a worldwide manhunt. As the valiant men of Bandito Platoon race to stop a coordinated attack that could kill and wound thousands of American civilians, they must balance their commitment to country, team and their families back home. Each time they accomplish their mission, a new piece of intelligence reveals another shocking twist to the deadly terror plot, which ..."	5.772926936
tt1179067	4500000	30525503	Igor Kharlamov	Mikhail Galustyan	Armen Dzhigarkhanyan	nm2152569	nm2804487	nm0246150	The Best Movie	2008	110	Comedy	nm2910439	"nm2909729,nm2152569,nm2910907,nm2911246,nm2910501"	3	2280	"Vadik Volnov dies on his own wedding of cannabis overdose and has to prove to God that he is worthy to enter Heaven. During his conversation with God's secretary, Vadik recalls numerous memorable moments of his earthly existence, such as getting drunk on cognac on his 8th birthday, service in the Soviet Army in Afghanistan, bandit showdowns in crime-ridden 1990s Russia, and, finally, meeting the love of his life."	5.783443604
tt3540136	12000000	81411331	Jing Wu	Nan Yu	Dahong Ni	nm0943104	nm0950544	nm0196433	Wolf Warrior	2015	90	"Action,Crime,Thriller"	nm0943104	"nm8127866,nm8127867,nm3146222,nm0943104"	5.4	3707	A Chinese special force soldier with extraordinary marksmanship is confronted by a group of deadly foreign mercenaries who are hired to assassinate him by a vicious drug lord.	5.784277018
tt1981677	17000000	115350426	Anna Kendrick	Brittany Snow	Rebel Wilson	nm0447695	nm0811242	nm2313103	Pitch Perfect	2012	112	"Comedy,Music,Romance"	nm0601337	"nm0134224,nm3015467"	7.2	260630	"The Barden Bellas are a collegiate, all-girls a cappella singing group thriving on female pop songs and their perfect looks. After a disastrous failing at last year's finals, they are forced to regroup. Among the new recruits is freshman Beca, an independent, aspiring DJ with no interest in the college life. But after she meets Jesse, from the rival all-male a cappella group, Beca has a new outlook and takes it upon herself to help the Bellas find their new look and sound and get back into the competition."	5.785318777
tt3148528	2822400	19164182	Leandro Hassum	Camila Morgado	Kiko Mascarenhas	nm1795849	nm1143788	nm0997457	Till Luck Do Us Part 2	2013	102	Comedy	nm0764367	"nm0193153,nm1041570"	4.9	1034	"Tino and Jane are once again in financial difficulties. The couple's bank balance is saved thanks to the unexpected death of Uncle Olavinho, who left a heritage of $100 million to be divided equally between Jane and her mother, Estela. As the last wish of the uncle was that his ashes be thrown on the Grand Canyon, Tino takes his wife and his two children to know Las Vegas. However, he is excited about gambling in a casino and lose all the money earned by Jane at the poker table. To make matters worse, he ows $10 million to a henchman of the Mexican Mafia, who want to receive the money at all costs."	5.790028065
tt2446042	48000000	326479141	Liam Neeson	Forest Whitaker	Maggie Grace	nm0000553	nm0001845	nm1192254	Taken 3	2014	108	"Action,Thriller"	nm0576298	"nm0000108,nm0436543"	6	167871	"Liam Neeson returns as ex-covert operative Bryan Mills, whose long awaited reconciliation with his ex-wife is tragically cut short when she is brutally murdered. Consumed with rage, and framed for the crime, he goes on the run to evade the relentless pursuit of the CIA, FBI and the police. For one last time, Mills must use his ""particular set of skills,"" to track down the real killers, exact his unique brand of justice, and protect the only thing that matters to him now - his daughter."	5.801648629
tt1477076	20000000	136150434	Tobin Bell	Costas Mandylor	Betsy Russell	nm0068551	nm0541908	nm0751018	Saw 3D: The Final Chapter	2010	90	"Horror,Mystery"	nm0340436	"nm1733317,nm1729303"	5.6	84820	"Detective Matt Gibson chases the psychotic Detective Mark Hoffman while Jigsaw's widow Jill Tuck tries to kill him as assigned by her husband. However he escapes and Jill meets Gibson and offers to sign an affidavit listing the murders committed by Hoffman. In return, she requests protection. Meanwhile, the prominent Jigsaw survivor and leader of a support group Bobby Dagen is abducted with his wife and friends and forced to play a mortal game to save not only his wife, but three of his colleagues as well."	5.80752136
tt0974661	20000000	136267476	Zac Efron	Matthew Perry	Leslie Mann	nm1374980	nm0001612	nm0005182	17 Again	2009	102	"Comedy,Drama,Fantasy"	nm0824882	nm0276821	6.3	169595	"At 17 Mike O'Donnell is on top of the world: he's the star of his high school basketball team, is a shoo-in for a college scholarship, and is dating his soul-mate, Scarlet. But at what's supposed to be his big game where a college scout is checking him out, Scarlet reveals that she's pregnant. Mike decides to leave the game and asks Scarlet to marry him, which she does. During their marriage, Mike can only whine about the life he lost because he married her, so she throws him out. When he also loses his job, he returns to the only place he's happy at, his old high school. While looking at his high school photo, a janitor asks him if he wishes he could be 17 again and he says yes. One night while driving he sees the janitor on a bridge ready to jump, and goes after him. When he returns to his friend Ned's house, where he has been staying, he sees that he is 17 again. He decides to take this opportunity to get the life he lost."	5.813373459
tt0299658	45000000	306776732	Renée Zellweger	Catherine Zeta-Jones	Richard Gere	nm0000250	nm0001876	nm0000152	Chicago	2002	113	"Comedy,Crime,Musical"	nm0551128	"nm0174374,nm0002080,nm0247939,nm0914362"	7.1	203743	Murderesses Velma Kelly (a chanteuse and tease who killed her husband and sister after finding them in bed together) and Roxie Hart (who killed her boyfriend when she discovered he wasn't going to make her a star) find themselves on death row together and fight for the fame that will keep them from the gallows in 1920s Chicago.	5.81726056
tt2709692	75000000	511595957	Benedict Cumberbatch	Cameron Seely	Rashida Jones	nm1212722	nm7372981	nm0429069	The Grinch	2018	85	"Animation,Family,Fantasy"	"nm0608714,nm0155528"	"nm1942829,nm0842476,nm0317450"	6.3	33140	"For their eighth fully animated feature, Illumination and Universal Pictures present The Grinch, based on Dr. Seuss' beloved holiday classic. The Grinch tells the story of a cynical grump who goes on a mission to steal Christmas, only to have his heart changed by a young girl's generous holiday spirit. Funny, heartwarming, and visually stunning, it's a universal story about the spirit of Christmas and the indomitable power of optimism. Academy Award® nominee Benedict Cumberbatch lends his voice to the infamous Grinch, who lives a solitary life inside a cave on Mt. Crumpet with only his loyal dog, Max, for company. With a cave rigged with inventions and contraptions for his day-to-day needs, the Grinch only sees his neighbors in Whoville when he runs out of food. Each year at Christmas they disrupt his tranquil solitude with their increasingly bigger, brighter, and louder celebrations. When the Whos declare they are going to make Christmas three times bigger this year, the Grinch ..."	5.821279336
tt0405422	26000000	177378645	Steve Carell	Catherine Keener	Paul Rudd	nm0136797	nm0001416	nm0748620	The 40-Year-Old Virgin	2005	116	"Comedy,Romance"	nm0031976	"nm0031976,nm0136797"	7.1	370510	"Andy at the age of 40 still hasn't had sex. He lets his secret slip at a poker game with his buds from work. After the revealing all his friends are on a mission to help get him laid. Along the way Andy meets a nice mom, Trish, and they fall head over heels for each other."	5.822255315
tt2948356	150000000	1023784195	Ginnifer Goodwin	Jason Bateman	Idris Elba	nm0329481	nm0000867	nm0252961	Zootopia	2016	108	"Adventure,Animation,Comedy"	"nm0397174,nm0601781,nm1158544"	"nm0397174,nm0601781,nm1158544,nm0714114,nm2888684,nm1601882,nm1601644,nm1074879"	8	393407	"From the largest elephant to the smallest shrew, the city of Zootopia is a mammal metropolis where various animals live and thrive. When Judy Hopps becomes the first rabbit to join the police force, she quickly learns how tough it is to enforce the law. Determined to prove herself, Judy jumps at the opportunity to solve a mysterious case. Unfortunately, that means working with Nick Wilde, a wily fox who makes her job even harder."	5.825227921
tt1060277	25000000	170764026	Mike Vogel	Jessica Lucas	Lizzy Caplan	nm1036181	nm1140300	nm0135221	Cloverfield	2008	85	"Horror,Sci-Fi,Thriller"	\N	\N	7	355558	"To celebrate Rob's massive promotion, his lover, Beth, and friends, decide to throw a massive surprise farewell party, now that he is about to move to Japan. However, a deafening explosion and the arrival of an enormous scaly and gangly creature will abruptly interrupt the festivities, as all hell breaks loose in New York City, and the Statue of Liberty is decapitated. As the reptilian behemoth levels Manhattan, a daring dash to rescue Beth begins, while at the same time, everything is recorded through the lens of a hand-held camcorder, amid mayhem and destruction. In the end, where did this relentless invader come from, and above all, is there a chance of survival? As they go to investigate, an adventure deep into the streets of New York begins, as the friends are determined to rescue Rob's true love."	5.830560767
tt3496334	26508	181554	Áron Ferenczik	Miklós Horváth	Bálint Györiványi	nm2425148	nm4690723	nm2772349	For Some Inexplicable Reason	2014	96	"Comedy,Drama"	nm2520391	nm2520391	7.6	3485	A trip to Lisbon helps a nerdy guy who is quickly approaching 30 finally get his mojo back.	5.848768343
tt2515086	10000000	68532898	Liam Payne	Harry Styles	Zayn Malik	nm3798384	nm4089170	nm4098557	One Direction: This Is Us	2013	92	"Documentary,Music"	nm1041597	\N	4.1	23045	"An intimate all-access look at life on the road for the global music phenomenon. Weaved with stunning live concert footage, this inspiring feature film tells the remarkable story of Niall, Zayn, Liam, Harry and Louis' meteoric rise to fame, from their humble hometown beginnings and competing on the X-Factor, to conquering the world and performing at London's famed O2 Arena. Hear it from the boys themselves and see through their own eyes what it's really like to be One Direction."	5.853289115
tt0375063	16000000	109706931	Paul Giamatti	Thomas Haden Church	Virginia Madsen	nm0316079	nm0002006	nm0000515	Sideways	2004	127	"Comedy,Drama,Romance"	nm0668247	"nm0681914,nm0668247,nm0852591"	7.5	171421	"A week before his friend Jack is to be married, best man Miles and the prospective groom head off to wine country for a week of fun, relaxation and - of course - wine drinking. Miles is the oenophile and does his best to teach Jack a bit about the art of appreciating great wine. All Jack cares about is drinking and carousing, something he accomplishes when he meets the attractive Stephanie at one of the vineyards. Miles is something of a sad sack, a high school English teacher who is a failed writer at heart. He has yet to get over the fact that his wife has divorced him and that she has remarried and he now faces that nerve racking wait for word from a prospective publisher. Miles has an opportunity to start anew when he meets Stephanie's friend Maya but when he let's slip that Jack is about to be married any hope of a relationship seems to be lost."	5.856682759
tt0441511	127950	877803	Eason Chan	Joey Yung	Francis Ng	nm0150873	nm1047242	nm0628757	Crazy N' the City	2005	93	"Comedy,Drama"	nm0950728	"nm1773635,nm0516352,nm0950728"	6.9	344	"When a serial killer emerges in Hong Kong, Man Liu, an energetic and conscientious policewoman, swears to catch him. Jack, a spineless constable, is impressed by her bravery and decides to secretly protect her."	5.860462208
tt0477348	25000000	171627166	Tommy Lee Jones	Javier Bardem	Josh Brolin	nm0000169	nm0000849	nm0000982	No Country for Old Men	2007	122	"Crime,Drama,Thriller"	"nm0001054,nm0001053"	"nm0001054,nm0001053,nm0565092"	8.1	781668	"In rural Texas, welder and hunter Llewelyn Moss (Josh Brolin) discovers the remains of several drug runners who have all killed each other in an exchange gone violently wrong. Rather than report the discovery to the police, Moss decides to simply take the two million dollars present for himself. This puts the psychopathic killer, Anton Chigurh (Javier Bardem), on his trail as he dispassionately murders nearly every rival, bystander and even employer in his pursuit of his quarry and the money. As Moss desperately attempts to keep one step ahead, the blood from this hunt begins to flow behind him with relentlessly growing intensity as Chigurh closes in. Meanwhile, the laconic Sheriff Ed Tom Bell (Tommy Lee Jones) blithely oversees the investigation even as he struggles to face the sheer enormity of the crimes he is attempting to thwart."	5.865086365
tt0317705	92000000	631606713	Craig T. Nelson	Samuel L. Jackson	Holly Hunter	nm0005266	nm0000168	nm0000456	The Incredibles	2004	115	"Action,Adventure,Animation"	nm0083348	nm0083348	8	615219	"Bob Parr (A.K.A. Mr. Incredible), and his wife Helen (A.K.A. Elastigirl), are the world's greatest famous crime-fighting superheroes in Metroville. Always saving lives and battling evil on a daily basis. But fifteen years later, they have been forced to adopt civilian identities and retreat to the suburbs where they have no choice but to retire as superheroes to live a ""normal life"" with their three children Violet, Dash and Jack-Jack (who were secretly born with superpowers). Itching to get back into action, Bob gets his chance when a mysterious communication summons him to a remote island for a top secret assignment. He soon discovers that it will take a super family effort to rescue the world from total destruction."	5.865290284
tt1567448	2000000	13734454	Cem Yilmaz	Ozan Güven	Zafer Algöz	nm0948000	nm0349777	nm0019338	Yahsi Bati	2009	112	"Comedy,Western"	nm0814716	nm0948000	7.4	27440	"In 1881, two Ottoman Secret Agents travel to the USA, at the Sultan's request, to deliver a valuable diamond as a gift for the President."	5.867223566
tt1855199	7000000	48126384	Jake Gyllenhaal	Michael Peña	Anna Kendrick	nm0350453	nm0671567	nm0447695	End of Watch	2012	109	"Action,Crime,Drama"	nm0043742	nm0043742	7.6	214283	"In South Central Los Angeles, street cops Brian and Mike are partners - balls-out cowboys patrolling the streets as Latino gangs are in a power struggle with Blacks. Brian and Mike get lucky a couple of times, making big drug and human-trafficking busts, so a Mexican cartel orders their deaths. We meet Mike's pregnant wife (whom he married out of high school) and watch Brian's search for a soul mate. There are internal squabbles within the ranks of the LAPD and lots of squad-car conversation. Can the lads escape the cartel's murderous reach?"	5.875196732
tt2220408	806400	5555822	Danton Mello	Lúcio Mauro Filho	Fábio Porchat	nm0578042	nm0561210	nm1167049	Vai que dá Certo	2013	110	Comedy	nm0267399	"nm0267399,nm5115855,nm1167049"	5.8	1188	5 friends have a plan to rob a transporter that can change their lives completed.	5.889651675
tt3722070	6000000	41387687	Maggie Smith	Alex Jennings	Jim Broadbent	nm0001749	nm0421105	nm0000980	The Lady in the Van	2015	104	"Biography,Comedy,Drama"	nm0405336	nm0003141	6.7	23704	"The Lady in the Van tells the true story of Alan Bennett's strained friendship with Miss Mary Shepherd, an eccentric homeless woman whom Bennett befriended in the 1970s before allowing her temporarily to park her Bedford van in the driveway of his Camden home. She stayed there for 15 years. As the story develops Bennett learns that Miss Shepherd is really Margaret Fairchild (died 1989), a former gifted pupil of the pianist Alfred Cortot. She had played Chopin in a promenade concert, tried to become a nun, was committed to an institution by her brother, escaped, had an accident when her van was hit by a motorcyclist for which she believed herself to blame, and thereafter lived in fear of arrest."	5.897946684
tt1399683	2000000	13796834	Jennifer Lawrence	John Hawkes	Garret Dillahunt	nm2225369	nm0370035	nm0226813	Winter's Bone	2010	100	"Drama,Mystery"	nm0335138	"nm0335138,nm1367893,nm0940410"	7.2	129079	"Her family home in danger of being repossessed after her dad skips bail and disappears, Ozark teen Ree Dolly (Jennifer Lawrence) breaks the local code of conduct by confronting her kin about their conspiracy of silence. Should she fail to track her father down, Ree Dolly, her younger siblings, and their disabled mother will soon be rendered homeless."	5.898413551
tt0848228	220000000	1518812988	Robert Downey Jr.	Chris Evans	Scarlett Johansson	nm0000375	nm0262635	nm0424060	The Avengers	2012	143	"Action,Adventure,Sci-Fi"	nm0923736	"nm0923736,nm0672015"	8	1202276	"Nick Fury is the director of S.H.I.E.L.D., an international peace-keeping agency. The agency is a who's who of Marvel Super Heroes, with Iron Man, The Incredible Hulk, Thor, Captain America, Hawkeye and Black Widow. When global security is threatened by Loki and his cohorts, Nick Fury and his team will need all their powers to save the world from disaster which is formed by Loki and his team"	5.903695369
tt0813541	1100000	7595138	Ekaterina Fedulova	Evgeniy Tsyganov	Aleksey Barabash	nm0270250	nm1142921	nm1068631	Piter FM	2006	85	"Comedy,Drama,Romance"	nm2294083	"nm2294083,nm2293972"	7	2824	"Lyrical story about two young people, Masha and Maksim, who have to decide what to do."	5.904664632
tt1673434	120000000	829746820	Kristen Stewart	Robert Pattinson	Taylor Lautner	nm0829576	nm1500155	nm1210124	The Twilight Saga: Breaking Dawn - Part 2	2012	115	"Adventure,Drama,Fantasy"	nm0174374	"nm0742279,nm2769412"	5.5	217894	"The final Twilight Saga begins with Bella now a vampire learning to use her abilities. And happy to see her daughter, Renesmee is flourishing. But when someone sees Renesmee do something that makes them think that she was turned. This person goes to the Volturi, because it is a violation to turn a child. And the penalty is death for both who turned the child into a vampire and the child, cause they deem a turned child too dangerous. Alice gets a vision of the Volturi coming after them. So the Cullens try to convince them that Renesmee is not a threat. So they ask friends and family to come stand with them. But when someone who has it in for the Volturi shows up and tells them they should be ready for a fight. And they get ready."	5.914556776
tt2278388	25000000	172936941	Ralph Fiennes	F. Murray Abraham	Mathieu Amalric	nm0000146	nm0000719	nm0023832	The Grand Budapest Hotel	2014	99	"Adventure,Comedy,Crime"	nm0027572	"nm0959003,nm0027572,nm2450453"	8.1	646364	"GRAND BUDAPEST HOTEL recounts the adventures of Gustave H, a legendary concierge at a famous European hotel between the wars, and Zero Moustafa, the lobby boy who becomes his most trusted friend. The story involves the theft and recovery of a priceless Renaissance painting and the battle for an enormous family fortune -- all against the back-drop of a suddenly and dramatically changing Continent."	5.917477363
tt1167599	8094400	56487596	Jonas Hämmerle	Waldemar Kobus	Günther Kaufmann	nm2961094	nm0462201	nm0442316	Vicky the Viking	2009	85	"Action,Adventure,Comedy"	nm0378660	"nm0378660,nm1149325,nm0081305,nm4380835"	5.5	2706	"Vicky is a viking-boy who lives with his parents Halvar and Ylva in the small village Flake. He is a typical viking boy, but rather fearful. He is also not very strong but smart. One day he sails with the grown up vikings out to the sea and to experience a great and funny adventure."	5.978601134
tt0385004	13264999	92863945	Ziyi Zhang	Takeshi Kaneshiro	Andy Lau	nm0955471	nm0437580	nm0490489	House of Flying Daggers	2004	119	"Action,Adventure,Drama"	nm0955443	"nm1104077,nm0910841,nm0955443"	7.5	103353	"During the reign of the Tang dynasty in China, a secret organization called ""The House of the Flying Daggers"" rises and opposes the government. A police officer called Leo sends officer Jin to investigate a young dancer named Mei, claiming that she has ties to the ""Flying Daggers"". Leo arrests Mei, only to have Jin breaking her free in a plot to gain her trust and lead the police to the new leader of the secret organization. But things are far more complicated than they seem..."	6.000674331
tt4052882	17000000	119100758	Blake Lively	Óscar Jaenada	Angelo Josue Lozano Corzo	nm0515116	nm1049982	nm8395137	The Shallows	2016	86	"Drama,Horror,Thriller"	nm1429471	nm1097510	6.3	110353	"In the taut thriller The Shallows, when Nancy (Blake Lively) is surfing on a secluded beach, she finds herself on the feeding ground of a great white shark. Though she is stranded only 200 yards from shore, survival proves to be the ultimate test of wills, requiring all of Nancy's ingenuity, resourcefulness, and fortitude."	6.005926529
tt4276752	37000000	259368448	Kun Chen	Angelababy	Qi Shu	nm1179512	nm2854802	nm0795517	Mojin - The Lost Legend	2015	127	"Action,Adventure,Drama"	nm4069612	"nm2310115,nm8701055"	6	3135	"In 1988, the three Mojin(tomb raider), Hu Bayi, Wang Kaixuan, and Shirley Yang, retires and relocates to New York. While Bayi and Shirley have become romantically involved and Kaixuan feels that the great Mojin deserve more than the financial despair they've faced in the States, the trio are pulled back into a grave-robbing game in Inner Mongolia, China, to explore the reason behind the death of Ding Sitian, who was Bayi and Kaixuan's first love died back in 1969."	6.009957865
tt0416449	65000000	456068181	Gerard Butler	Lena Headey	David Wenham	nm0124930	nm0372176	nm0920992	300	2006	117	"Action,Drama,Fantasy"	nm0811583	"nm0811583,nm0426500,nm1290582,nm0588340,nm2241067"	7.7	700375	"In the Battle of Thermopylae of 480 BC an alliance of Greek city-states fought the invading Persian army in the mountain pass of Thermopylae. Vastly outnumbered, the Greeks held back the enemy in one of the most famous last stands of history. Persian King Xerxes led a Army of well over 100,000 (Persian king Xerxes before war has about 170,000 army) men to Greece and was confronted by 300 Spartans, 700 Thespians, and 400 Thebans. Xerxes waited for 10 days for King Leonidas to surrender or withdraw but left with no options he pushed forward. After 3 days of battle all the Greeks were killed. The Spartan defeat was not the one expected, as a local shepherd, named Ephialtes, defected to the Persians and informed Xerxes that the separate path through Thermopylae, which the Persians could use to outflank the Greeks, was not as heavily guarded as they thought."	6.016433446
