Title	Budget	Box_Office	Star1	Star2	Star3	Star_num1	Star_num2	Star_num3	Name	Year	Run_Time	Genre	Director_num	Writer_num	Average_Rating	Num_Voters	Story_Line	Ratio
tt0362120	45000000	178262620	Anna Faris	Regina Hall	Craig Bierko	nm0267506	nm0356021	nm0081572	Scary Movie 4	2006	83	Comedy	nm0001878	"nm0563301,nm0000720,nm0698493,nm0915465,nm0005541,nm0424688,nm0064556,nm0294997,nm0783536"	5	108089	"The unemployed Cindy Campbell is hired to work in a cursed house as caretaker of an old lady and meets the ghost of a boy. Meanwhile, the teenager son Robbie and the young daughter Rachel of his next door neighbor and crane operator Tom Ryan are spending the weekend with their loser father. Cindy and Tom meet and fall in love for each other, but when Giant Tripods invade Earth, Tom escapes with Robbie and Rachel; Cindy travels to a village, trying to find the answer to a riddle to save the world; and the president of USA organizes the defense of the planet in UN under his intelligence and leadership."	2.961391468
tt0295701	70000000	277448382	Vin Diesel	Asia Argento	Marton Csokas	nm0004874	nm0000782	nm0190744	xXx	2002	124	"Action,Adventure,Thriller"	nm0003418	nm0929186	5.9	167595	"Xander ""XXX"" Cage is a thrill seeker who until now has been deemed untouchable by the law. NSA Agent Gibbons forces XXX to cooperate with the government to infiltrate an underground Russian crime ring, and avoid going to prison. Gibbons sends XXX to enter this world of crime undetected where others have failed, using his natural athletic prowess and a whole lot of attitude. Xander must combat an organization led by a clever, ruthless and nihilistic Yorgi whose first target is the city of Prague."	2.963548258
tt0163025	93000000	368780809	Sam Neill	William H. Macy	Téa Leoni	nm0000554	nm0000513	nm0000495	Jurassic Park III	2001	92	"Action,Adventure,Sci-Fi"	nm0002653	"nm0000341,nm0118224,nm0668247,nm0852591"	5.9	279228	"Dr. Alan Grant is now a happy man with the previous incidents of Jurassic Park now behind him. Grant is that happy that he announce in public, that nothing on Earth can persuade him back onto the islands. Maybe nothing, except Paul Kirby. Kirby and his wife, Amanda want a plane to fly them over Isla Sorna, with Dr. Grant as their guide. But not everything Kirby says is true. When the plane lands, Dr. Grant realizes that there is another reason why they are there, that he doesn't know of. Now, Dr. Grant is stuck on an island he has never been on before, with what was a plane journey now turned into a search party."	2.965385
tt0401792	40000000	158733820	Mickey Rourke	Clive Owen	Bruce Willis	nm0000620	nm0654110	nm0000246	Sin City	2005	124	"Crime,Thriller"	"nm0001675,nm0588340,nm0000233"	nm0588340	8	720255	"Four tales of crime adapted from Frank Miller's popular comics, focusing around a muscular brute who's looking for the person responsible for the death of his beloved Goldie, a man fed up with Sin City's corrupt law enforcement who takes the law into his own hands after a horrible mistake, a cop who risks his life to protect a girl from a deformed pedophile, and a hitman looking to make a little cash."	2.968345401
tt1327194	25000000	99357138	Zac Efron	Taylor Schilling	Blythe Danner	nm1374980	nm2279940	nm0001100	The Lucky One	2012	101	"Drama,Mystery,Romance"	nm0382956	"nm3391497,nm0817023"	6.5	95741	"Logan is a marine serving in Iraq. While there, he finds a photo of a girl with ""keep safe"" written on the back. He is admiring it when his unit is attacked. He survives and credits the photo for saving him. He tries to find the owner but can't, assuming he was killed. When he goes back to the States, he finds it difficult to adjust and is still haunted by what happened. Analyzing the photo, he finds in the background a landmark that tells him she is in Louisiana. He then goes there and finds her. He learns her name is Beth. He tries to tell her what happened but can't get the words out. She assumes he's there to apply for the job they advertised looking for someone to help at her family's business, a dog kennel. He says yes but at first she gets an uneasy feeling from him but her grandmother decides to give him a chance. It isn't long that he makes a connection with her son. He then discovers that it was her brother who had the picture only he doesn't remember him. He sees that her ..."	2.974285361
tt1535109	55000000	218791811	Tom Hanks	Barkhad Abdi	Barkhad Abdirahman	nm0000158	nm5831542	nm5831543	Captain Phillips	2013	134	"Biography,Drama,Thriller"	nm0339030	"nm0712753,nm3697679,nm5643170"	7.8	393267	"Captain Phillips is a multi-layered examination of the 2009 hijacking of the U.S. container ship Maersk Alabama by a crew of Somali pirates. It is - through director Paul Greengrass's distinctive lens - simultaneously a pulse-pounding thriller, and a complex portrait of the myriad effects of globalization. The film focuses on the relationship between the Alabama's commanding officer, Captain Richard Phillips (two time Academy Award®-winner Tom Hanks), and the Somali pirate captain, Muse (Barkhad Abdi), who takes him hostage. Phillips and Muse are set on an unstoppable collision course when Muse and his crew target Phillips' unarmed ship; in the ensuing standoff, 145 miles off the Somali coast, both men will find themselves at the mercy of forces beyond their control."	2.978032855
tt1123373	13000000	51723285	Tony Ka Fai Leung	Chao Deng	Carina Lau	nm0504899	nm2874732	nm0490500	Detective Dee: The Mystery of the Phantom Flame	2010	123	"Action,Adventure,Drama"	nm0007139	"nm2310115,nm0155295,nm4488556"	6.6	9854	"In 689 A.D., the Empress Wu Zetian is building a 66 m high statue of Buddha for her inauguration as the first empress of China under the objections and conspiracy of the other clans. When the engineer responsible for the construction mysteriously dies by spontaneous combustion, the superstitious workers are afraid since the man removed the good luck charms from the main pillar. There is an investigation of Pei Donglai and another investigator that also dies after withdrawing the amulets. Empress Wu assigns her loyal assistant Shangguan Jing'er to release the exiled Detective Dee from his imprisonment to investigate with Donglai and Jing'er the mystery of the deaths. They ride in a mystic and epic adventure to unravel the mystery."	2.978713925
tt0356634	50000000	198964901	Breckin Meyer	Jennifer Love Hewitt	Stephen Tobolowsky	nm0005227	nm0001349	nm0864997	Garfield	2004	80	"Animation,Comedy,Family"	nm0382072	"nm0204825,nm0169505,nm0812513"	5	73642	"Garfield, the fat, lazy, lasagna lover, has everything a cat could want. But when Jon, in an effort to impress the Liz - the vet and an old high-school crush - adopts a dog named Odie and brings him home, Garfield gets the one thing he doesn't want. Competition. One night Odie runs away and gets dog-napped after Garfield locks him outside. Garfield, in an out of character move, goes to search for and rescue Odie with the help of a variety of animal friends along the way."	2.97929794
tt1385912	13000000	51733921	Tyler Perry	Taraji P. Henson	Adam Rodriguez	nm1347153	nm0378245	nm0735226	I Can Do Bad All by Myself	2009	113	"Comedy,Drama"	nm1347153	nm1347153	4.4	9264	"When Madea catches sixteen-year-old Jennifer and her two younger brothers looting her home, she decides to take matters into her own hands and delivers the young delinquents to the only relative they have: their aunt April. A heavy-drinking nightclub singer who lives off of Randy, her married boyfriend, April wants nothing to do with the kids. But her attitude begins to change when Sandino, a handsome Colombian immigrant looking for work, moves into April's basement room. Making amends for his own troubled past, Sandino challenges April to open her heart. And April soon realizes she must make the biggest choice of her life: between her old ways with Randy and the new possibilities of family, faith ... and even true love."	2.979532078
tt7394636	1500000	5969619	Dmitriy Nagiev	Dmitry Brauer	Georges Devdariani	nm1166576	nm4991850	nm4136611	Unforgiven	2018	106	Drama	nm3550361	"nm3550361,nm7816887,nm5702037,nm9286149"	6.2	602	Vitaliy Kaloev's life has stopped at the moment when the plane with his wife and children collides with the cargo plane. He's searching for justice and persuades air navigation company to apologize and confess it's guilt for disaster.	2.979743347
tt5790492	2731860	10873271	Javier Cámara	Jose Coronado	Roberto Álamo	nm0194572	nm0180580	nm0959304	It's for Your Own Good	2017	93	Comedy	nm1724912	"nm1990571,nm2162921"	5.5	1517	"Arturo, Chus and Hipólito (""Poli"") are the brothers-in-law that their peaceful and happy existence shock suddenly: Valentina, Arturo and Isabel's daughter, decides in the last moment not marry with Agustín, leaving him alone in the own altar, in order to stay with Álex, a young perroflauta (Spanish for dreadlock) and anarchist, which free ideals opposite straightly with the totally conservative Arturo; Chus and his wife Olga discover that their daughter Marta is dating with Dani, a troubled boy and ni-ni (Spanish short for ""ni oficio ni beneficio"", equivalent to ""without a penny to one's name"") related with drugs; and Poli realizes that his daughter Sarai is dating with Ernesto, a Poli's former school partner and actually a playboy who works as artistic photographer, in addition that Alicia, Poli's wife, knew Sarai's relation but she hide it. Determined to break the relation in the belief that Álex, Dani and Ernesto aren't good for their lovely and perfect daughters, Arturo, Chus and ..."	2.980169928
tt0332280	29000000	115533700	Gena Rowlands	James Garner	Rachel McAdams	nm0001687	nm0001258	nm1046097	The Notebook	2004	123	"Drama,Romance"	nm0001024	"nm0505230,nm0764982,nm0817023"	7.8	483891	"In a nursing home, resident Duke reads a romance story to an old woman who has senile dementia with memory loss. In the late 1930s, wealthy seventeen year-old Allie Hamilton is spending summer vacation in Seabrook. Local worker Noah Calhoun meets Allie at a carnival and they soon fall in love with each other. One day, Noah brings Allie to an ancient house that he dreams of buying and restoring and they attempt to make love but get interrupted by their friend. Allie's parents do not approve of their romance since Noah belongs to another social class, and they move to New York with her. Noah writes 365 letters (A Year) to Allie, but her mother Anne Hamilton does not deliver them to her daughter. Three years later, the United States joins the World War II and Noah and his best friend Fin enlist in the army, and Allie works as an army nurse. She meets injured soldier Lon Hammond in the hospital. After the war, they meet each other again going on dates and then, Lon, who is wealthy and ..."	2.983920552
tt2245084	165000000	657827828	Ryan Potter	Scott Adsit	Jamie Chung	nm3994407	nm0012523	nm1512166	Big Hero 6	2014	102	"Action,Adventure,Animation"	"nm2320658,nm0930261"	"nm1471001,nm0047916,nm0314870,nm2185413,nm2400268,nm0745691"	7.8	379744	"When a devastating event befalls the city of San Fransokyo and catapults Hiro into the midst of danger, he turns to Baymax and his close friends adrenaline junkie Go Go Tomago, neatnik Wasabi, chemistry whiz Honey Lemon and fanboy Fred. Determined to uncover the mystery, Hiro transforms his friends into a band of high-tech heroes called ""Big Hero 6."""	2.986835297
tt0478970	130000000	519311965	Paul Rudd	Michael Douglas	Corey Stoll	nm0748620	nm0000140	nm1015684	Ant-Man	2015	117	"Action,Adventure,Comedy"	nm0715636	"nm0942367,nm0180428,nm0570912,nm0748620,nm0498278,nm1293367,nm0456158"	7.3	518943	"Armed with the astonishing ability to shrink in scale but increase in strength, con-man Scott Lang must embrace his inner-hero and help his mentor, Dr. Hank Pym, protect the secret behind his spectacular Ant-Man suit from a new generation of towering threats. Against seemingly insurmountable obstacles, Pym and Lang must plan and pull off a heist that will save the world."	2.994707392
tt1590193	30000000	119942387	Liam Neeson	Vera Farmiga	Patrick Wilson	nm0000553	nm0267812	nm0933940	The Commuter	2018	105	"Action,Mystery,Thriller"	nm1429471	"nm2068778,nm2071379,nm0257513"	6.3	87681	"Now a hard-working life insurance salesman and a caring family man, the former police officer, Michael MacCauley, has taken the commuter rail to New York for the past ten years. But, unexpectedly, things will take a turn for the worse, when on one of his daily journeys, the cryptic passenger, Joanna, makes Michael a generous and tempting offer to locate a single commuter or face grave consequences. Is this a sick joke, or is this indeed a serious situation? As Michael races against the clock to solve this wicked conundrum, everyone aboard is a suspect, in a deal where there's definitely more than meets the eye. Can he decide in time who's the one?"	2.998079433
tt0461770	85000000	340487652	Amy Adams	Susan Sarandon	James Marsden	nm0010736	nm0000215	nm0005188	Enchanted	2007	107	"Animation,Comedy,Family"	nm0510674	nm0446210	7	167397	"The beautiful princess Giselle is banished by an evil queen from her magical, musical animated land and finds herself in the gritty reality of the streets of modern-day Manhattan. Shocked by this strange new environment that doesn't operate on a ""happily ever after"" basis, Giselle is now adrift in a chaotic world badly in need of enchantment. But when Giselle begins to fall in love with a charmingly flawed divorce lawyer who has come to her aid - even though she is already promised to a perfect fairy tale prince back home - she has to wonder: Can a storybook view of romance survive in the real world?"	3.005737035
tt0415978	2000000	8012838	John Hawkes	Miranda July	Miles Thompson	nm0370035	nm0432380	nm0999419	Me and You and Everyone We Know	2005	91	"Comedy,Drama"	nm0432380	nm0432380	7.3	33639	"'Me and You and Everyone We Know' is a poetic and penetrating observation of how people struggle to connect with one another in an isolating and contemporary world. Christine Jesperson is a lonely artist and ""Eldercab"" driver who uses her fantastical artistic visions to draw her aspirations and objects of desire closer to her. Richard Swersey, a newly single shoe salesman and father of two boys, is prepared for amazing things to happen. But when he meets the captivating Christine, he panics. Life is not so oblique for Richard's six-year-old Robby, who is having a risqué Internet romance with a stranger, and his fourteen-year-old brother Peter who becomes the guinea pig for neighborhood girls -- practicing for their future of romance and marriage."	3.006416997
tt3966404	1315340	5274664	Günes Sensoy	Doga Zeynep Doguslu	Tugba Sunguroglu	nm7322143	nm7322144	nm7322145	Mustang	2015	97	Drama	nm2197025	"nm2197025,nm1356951"	7.6	31659	"Early summer. In a village in northern Turkey, Lale and her four sisters are walking home from school, playing innocently with some boys. The immorality of their play sets off a scandal that has unexpected consequences. The family home is progressively transformed into a prison; instruction in homemaking replaces school and marriages start being arranged. The five sisters who share a common passion for freedom, find ways of getting around the constraints imposed on them."	3.010111446
tt1682181	1100000	4411649	Ja'Meya Jackson	Kelby Johnson	Lona Johnson	nm4956400	nm4956884	nm5601087	Bully	2011	98	Documentary	nm1097276	"nm2697011,nm1097276"	7.3	9643	"This year, over 13 million American kids will be bullied at school, online, on the bus, at home, through their cell phones and on the streets of their towns, making it the most common form of violence young people in this country experience. BULLY is the first feature documentary film to show how we've all been affected by bullying, whether we've been victims, perpetrators or stood silent witness. The world we inhabit as adults begins on the playground. BULLY opens on the first day of school. For the more than 13 million kids who'll be bullied this year in the United States, it's a day filled with more anxiety and foreboding than excitement. As the sun rises and school busses across the country overflow with backpacks, brass instruments and the rambunctious sounds of raging hormones, this is a ride into the unknown. For a lot of kids, the only thing that's certain is that this year, like every other, bullying will be a big part of whatever meets them at their school's front doors. ..."	3.010586354
tt0274166	40000000	160466000	Rowan Atkinson	John Malkovich	Natalie Imbruglia	nm0000100	nm0000518	nm0001386	Johnny English	2003	88	"Action,Adventure,Comedy"	nm0398185	"nm0701031,nm0905498,nm0204030,nm0398185"	6.2	139402	Rowan plays the eponymous lead character in a spoof spy thriller. During the course of the story we follow our hero as he attempts to single-handedly save the country from falling into the hands of a despot.	3.0116499
tt1393746	25000000	100297064	Daoming Chen	Chen Li	Yi Lu	nm0155203	nm3155266	nm1254646	Aftershock	2010	135	Drama	nm0271815	"nm1407934,nm4207856"	7.6	8287	"In Tangshan, the truck driver Da Qiang, his wife Yuan Ni and their twins Fang Da, their son, and Fang Deng, their daughter, are a happy simple family. On 27 July 1976, a devastating earthquake destroys Tangshan, and Da Qiang dies while trying to rescue his children from their apartment. When a collapsed beam traps Fang Da and Fang Deng, Yuan Ni is forced to decide between saving her son or daughter and she chooses Fang Da. However, her daughter Fang Deng overhears her mother's choice and miraculously survives. She is rescued by a soldier and adopted by Mr. Wang and his wife with the name Wang Deng. Thirty-two years later, after an earthquake in China, Wang Deng, now married to a Canadian lawyer and living in Vancouver with her daughter, travels to China and voluntarily joins the rescue team. By chance she meets Fang Da and she learns the drama of Yuan Ni through all those years. The family is finally reunited at Yuan Ni's home, where bitterness is exposed and resolved."	3.0118824
tt3263904	60000000	240797623	Tom Hanks	Aaron Eckhart	Laura Linney	nm0000158	nm0001173	nm0001473	Sully	2016	96	"Biography,Drama"	nm0000142	"nm0464548,nm3314810,nm5293055"	7.4	209819	"On Thursday, January 15, 2009, the world witnessed the ""Miracle on the Hudson"" when pilot Chesley""Sully"" Sullenberger (Tom Hanks) glided his disabled plane onto the frigid waters of the Hudson River, saving the lives of all one hundred fifty-five aboard. However, even as Sully was being heralded by the public and the media for his unprecedented feat of aviation skill, an investigation was unfolding that threatened to destroy his reputation and his career."	3.01329365
tt0425598	3000000	12051924	Dave Chappelle	Yasiin Bey	Lauryn Hill	nm0152638	nm0080049	nm0005012	Dave Chappelle's Block Party	2005	103	"Comedy,Documentary,Music"	nm0327273	nm0152638	7.2	8542	"Dave Chappelle presents a Brooklyn neighborhood with its very own once-in-a-lifetime free block party. In addition to Chappelle, the roster of artists includes Kanye West, Mos Def, Talib Kweli, Common, Dead Prez, Erykah Badu, Jill Scott, the Roots, Cody ChesnuTT, Big Daddy Kane, and - reunited for their first performance in over seven years - the Fugees. Includes private rehearsals footage and Chappelle in the small Ohio town he calls home, where he wanders through town handing out golden tickets to invite several dozen citizens to join the party, providing transportation and lodging for their visit to Brooklyn. Ohio's Central State University marching band makes the trip and kicks off the festivities at the intersection of Quincy and Downing Streets. A diverse crowd and Chappelle's freestyle wit guides them (and us) through a celebration of music and comedy, history and community."	3.017306661
tt0386032	9000000	36163768	Michael Moore	Tucker Albrizzi	Tony Benn	nm0601619	nm3235380	nm1125277	Sicko	2007	123	"Documentary,Drama"	nm0601619	nm0601619	7.9	72008	"Documentary look at health care in the United States as provided by profit-oriented health maintenance organizations (HMOs) compared to free, universal care in Canada, the U.K., and France. Moore contrasts U.S. media reports on Canadian care with the experiences of Canadians in hospitals and clinics there. He interviews patients and doctors in the U.K. about cost, quality, and salaries. He examines why Nixon promoted HMOs in 1971, and why the Clintons' reform effort failed in the 1990s. He talks to U.S. ex-pats in Paris about French services, and he takes three 9/11 clean-up volunteers, who developed respiratory problems, to Cuba for care. He asks of Americans, ""Who are we?"""	3.018195998
tt3152624	35000000	140795793	Amy Schumer	Bill Hader	Brie Larson	nm2154960	nm0352778	nm0488953	Trainwreck	2015	125	"Comedy,Drama,Romance"	nm0031976	nm2154960	6.2	123438	"Despite having a love/hate relationship with her scoundrel of a father Gordon Townsend, the one thing Amy Townsend has grown up believing from him is that monogamy isn't realistic, he and Amy's mom who broke up due to infidelity when Amy was young. As such, she gets drunk and stoned frequently in her pursuit of indiscriminate sex, with an unstated rule that there is no sleeping over once the sex is over. Her current ""boyfriend"", Steven, believes they are exclusive, not knowing that she sleeps with other men. Working at sensationalistic magazine S'nuff under head sensationalist Dianna, Amy is in line for a promotion, she certain to get it if her next story meets Dianna's scrutiny. That story is a profile of sports doctor to the stars, Dr. Aaron Conners, it despite Amy knowing nothing about sports. To Amy's amazement, Aaron wants to date her following their first sexual encounter, his sexual history in terms of quantity which is in extreme contrast to her own. Also to her amazement, she..."	3.022736828
tt0281358	11800000	47494916	Mandy Moore	Shane West	Peter Coyote	nm0601553	nm0922342	nm0001075	A Walk to Remember	2002	101	"Drama,Romance"	nm0788202	"nm0817023,nm0418321"	7.4	190391	"In North Carolina especially in Beaufort a prank on a guy goes wrong and puts the student in the clinic. Carter, a famous student with no plans for the future, is held responsible and forced to join in after-school community service activities as consequence, which include starring as the lead in the play. And participating in these activities is Jamie Sullivan, the reverend's daughter who has great ambitions and nothing in common with Landon. When Landon decides he wants to take his activities seriously, he asks Jamie for help and begins to spend most of his time with her. But he starts to like her, that he did not expect to do. They relationship, much to the chagrin of Landon's old popular friends and Jamie's strict reverend father. But when a heart-breaking secret becomes known that puts their relationship to the test, it is then that Landon and Jamie realize the true meaning of love and fate."	3.02499254
tt0440963	110000000	442824138	Matt Damon	Edgar Ramírez	Joan Allen	nm0000354	nm1183149	nm0000260	The Bourne Ultimatum	2007	115	"Action,Mystery,Thriller"	nm0339030	"nm0006904,nm1994243,nm1079776,nm0524924"	8	583890	"Bourne is once again brought out of hiding, this time inadvertently by London-based reporter Simon Ross who is trying to unveil Operation Blackbriar--an upgrade to Project Treadstone--in a series of newspaper columns. Bourne sets up a meeting with Ross and realizes instantly they're being scanned. Information from the reporter stirs a new set of memories, and Bourne must finally, ultimately, uncover his dark past whilst dodging The Company's best efforts in trying to eradicate him."	3.025673945
tt0479952	150000000	603900354	Ben Stiller	Chris Rock	David Schwimmer	nm0001774	nm0001674	nm0001710	Madagascar: Escape 2 Africa	2008	89	"Adventure,Animation,Comedy"	"nm0569891,nm0201509"	"nm1000113,nm0201509,nm0569891,nm0123666,nm1129905"	6.6	188567	"The sequel to 2005's ""Madagascar"", in which New York Zoo animals, Alex the Lion, Marty the Zebra, Melman the Giraffe and Gloria the Hippo, still stranded on Madagascar, start to leave the island. All of a sudden, they land in the wilderness of Africa, where Alex meets the rest of his family, but has trouble communicating with them after spending so much time at the Central Park Zoo."	3.026002333
tt0816442	19000000	76586316	Sophie Nélisse	Geoffrey Rush	Emily Watson	nm4563869	nm0001691	nm0001833	The Book Thief	2013	131	"Drama,War"	nm1093053	"nm2295691,nm0678104"	7.6	120596	"In 1938, the young girl Liesel Meminger is traveling by train with her mother and her younger brother when he dies. Her mother buries the boy in a cemetery by the tracks and Liesel picks up a book, ""The Gravediggers Handbook"", which was left on the grave of her brother and brings it with her. Liesel is delivered to a foster family in a small town and later she learns that her mother left her because she is a communist. Her stepmother, Rosa Hubermann, is a rude but caring woman and her stepfather, Hans Hubermann, is a simple kind-hearted man. Liesel befriends her next door neighbor, the boy Rudy Steiner, and they go together to the school. When Hans discovers that Liesel cannot read, he teaches her using her book and Liesel becomes an obsessed reader. During a Nazi speech where the locals are forced to burn books in a bonfire, Liesel recovers one book for her and the Mayor's wife Ilsa Hermann witnesses her action. Meanwhile Hans hides the Jewish Max Vandenburg, who is the son of a ..."	3.030858525
